name,nome_programa
2a78517f-a7d3-474a-9a3f-a0c6ae535846,Josemeire Machado Dias,"Pós-doutorado pelo Programa de Pós-Graduação em Ensino, Filosofia e História das Ciências - UFBa com projeto voltado para o estudo da Influência de Pierre Bourdieu na Produção Científica da Área de Design e a sua Interface com a Educação . Doutora em Educação e Contemporaneidade pelo Programa de Pós-Graduação em Educação e Contemporaneidade da Universidade do Estado da Bahia - UNEB com pesquisa na área de desenvolvimento e avaliação de Jogos educacionais digitais. Mestre em Redes de Computadores com trabalho na área de Mineração Visual de dados. Especialista em Marketing. Licenciada em Educação Artística com ênfase em Artes Plásticas. Bacharel em Ciência da Computação. Professora Adjunta da Universidade do Estado da Bahia, Campus I - Salvador, nos cursos de graduação em Design e do Programa de Pós-Graduação Gestão e Tecnologias Aplicadas à Educação - GESTEC, na área de Concentração II, Processos Tecnológicos e Redes Sociais. Membro do corpo de Especialistas da Editora da Universidade Federal da Bahia - EDUFBA. Coordenadora do Grupo de pesquisas LUCIE - Lab. de Usabilidade, Cultura, Interfaces e Educação, vinculado ao Departamento de Ciências Exatas e da Terra, colegiado de Design - UNEB e GESTEC. Atuou como bolsista do programa institucional de apoio à tecnologia e inovação (PIBATI) na Agência UNEB nos anos  2017 a 2019 e em 2022.  Os temas de interesse em pesquisa são, principalmente: Jogos educacionais; Educação e Tecnologias; Design de interfaces; Design Emocional e ambientes de aprendizagens.",GESTÃO E TECNOLOGIAS APLICADAS À EDUCAÇÃO,"'2017':208A '2019':210A '2022':213A 'a':37A,41A,209A 'adjunta':109A 'agência':204A 'ambientes':233A 'anos':207A 'ao':176A 'aplicadas':135A,242C 'apoio':197A 'aprendizagens':235A 'artes':101A 'artística':97A 'atuou':190A 'avaliação':72A 'bacharel':103A 'bahia':63A,115A,160A 'bolsista':192A 'bourdieu':28A 'campus':116A 'científica':31A 'ciência':105A 'ciências':16A,179A 'colegiado':184A 'com':18A,40A,65A,82A,98A 'como':191A 'computadores':81A 'computação':107A 'concentração':142A 'contemporaneidade':47A,57A 'coordenadora':162A 'corpo':151A 'cultura':171A 'cursos':120A 'da':24A,32A,58A,62A,106A,110A,114A,154A,156A,159A,182A 'dados':90A 'das':15A 'de':6A,26A,34A,50A,69A,73A,80A,86A,89A,121A,128A,141A,152A,165A,169A,178A,185A,196A,216A,228A,234A 'departamento':177A 'desenvolvimento':70A 'design':35A,124A,186A,227A,230A 'dias':238B,247A 'digitais':76A 'do':60A,112A,126A,150A,163A,193A 'doutora':43A 'doutorado':3A 'e':13A,36A,46A,56A,71A,125A,133A,146A,173A,181A,188A,200A,211A,225A,232A,240C 'editora':155A 'educacionais':75A,223A 'educação':42A,45A,55A,96A,137A,174A,224A,244C 'edufba':161A 'em':10A,44A,54A,78A,92A,95A,100A,104A,123A,212A,218A 'emocional':231A 'ensino':11A 'especialista':91A 'especialistas':153A 'estado':61A,113A 'estudo':23A 'exatas':180A 'federal':158A 'filosofia':12A 'gestec':138A,189A 'gestão':132A,239C 'graduação':9A,53A,122A,131A 'grupo':164A 'história':14A 'i':117A 'ii':143A 'influência':25A 'inovação':201A 'institucional':195A 'interesse':217A 'interface':39A 'interfaces':172A,229A 'jogos':74A,222A 'josemeire':236B,245A 'lab':168A 'licenciada':94A 'lucie':167A 'machado':237B,246A 'marketing':93A 'membro':149A 'mestre':77A 'mineração':87A 'na':29A,67A,84A,139A,203A 'nos':119A,206A 'o':22A 'os':214A 'para':21A 'pelo':4A,48A 'pesquisa':66A,219A 'pesquisas':166A 'pibati':202A 'pierre':27A 'plásticas':102A 'principalmente':221A 'processos':144A 'produção':30A 'professora':108A 'programa':5A,49A,127A,194A 'projeto':19A 'pós':2A,8A,52A,130A 'pós-doutorado':1A 'pós-graduação':7A,51A,129A 'redes':79A,147A 'salvador':118A 'sociais':148A 'sua':38A 'são':220A 'tecnologia':199A 'tecnologias':134A,226A,241C 'tecnológicos':145A 'temas':215A 'terra':183A 'trabalho':83A 'ufba':17A 'uneb':64A,187A,205A 'universidade':59A,111A,157A 'usabilidade':170A 'vinculado':175A 'visual':88A 'voltado':20A 'à':136A,198A,243C 'área':33A,68A,85A,140A 'ênfase':99A",0.06666667
faabe340-9d2f-4a02-9500-f5a96849072d,Hugo Saba Pereira Cardoso,"Bolsista Produtividade CNPq,  Coordenador da Câmara de Computação na FAPESB, Pós Doutorado em Modelagem Computacional no Cimatec (2016), Doutorado em Difusão do Conhecimento na Universidade Federal da Bahia (UFBA)(2013), Mestrado em Modelagem Computacional pela FVC (2005),  Especialização em Computação Científica pela Fundação Visconde de Cairu (FVC) (2003) e Graduação em Processamento de Dados pela Faculdade Rui Barbosa (1995),  Professor Titular na UNEB. Tem experiência na área de Ciência da Computação, atuando principalmente nos seguintes temas: modelagem computacional, tecnologias sociais, robótica educacional, gestão de projetos e difusão do conhecimento. No âmbito profissional coordena projetos de pesquisa e desenvolvimento, junto a Instituições de Ciência e Tecnologia (ICTs). Na Pós Graduação é Coordenador da Linha 1 do Doutorado em Difusão do Conhecimento (DMMDC), Professor Permanente no Programa Modelagem Computacional e Tecnologia Industrial(MCTI), Professor Colaborador no Mestrado Profissional em Propriedade Intelectual e Transferência de Tecnologia para a Inovação(PROFNIT), e Coordenador do Grupo de Pesquisa no CNPq  - NÚCLEO DE PESQUISA APLICADA E INOVAÇÃO (NPAI) - Contato: hugosaba@pq.cnpq.br",DIFUSÃO DO CONHECIMENTO IFBA - SENAI/CIMATEC - LNCC - UNEB - UEFS,"'1':114A '1995':59A '2003':48A '2005':37A '2013':30A '2016':18A 'a':100A,145A 'aplicada':159A 'atuando':72A 'bahia':28A 'barbosa':58A 'bolsista':1A 'cairu':46A 'cardoso':168B,180A 'científica':41A 'cimatec':17A 'ciência':69A,103A 'cnpq':3A,155A 'colaborador':133A 'computacional':15A,34A,78A,127A 'computação':8A,40A,71A 'conhecimento':23A,89A,120A,171C 'contato':163A 'coordena':93A 'coordenador':4A,111A,149A 'câmara':6A 'da':5A,27A,70A,112A 'dados':54A 'de':7A,45A,53A,68A,84A,95A,102A,142A,152A,157A 'desenvolvimento':98A 'difusão':21A,87A,118A,169C 'dmmdc':121A 'do':22A,88A,115A,119A,150A,170C 'doutorado':12A,19A,116A 'e':49A,86A,97A,104A,128A,140A,148A,160A 'educacional':82A 'em':13A,20A,32A,39A,51A,117A,137A 'especialização':38A 'experiência':65A 'faculdade':56A 'fapesb':10A 'federal':26A 'fundação':43A 'fvc':36A,47A 'gestão':83A 'graduação':50A,109A 'grupo':151A 'hugo':165B,177A 'hugosaba@pq.cnpq.br':164A 'icts':106A 'ifba':172C 'industrial':130A 'inovação':146A,161A 'instituições':101A 'intelectual':139A 'junto':99A 'linha':113A 'lncc':174C 'mcti':131A 'mestrado':31A,135A 'modelagem':14A,33A,77A,126A 'na':9A,24A,62A,66A,107A 'no':16A,90A,124A,134A,154A 'nos':74A 'npai':162A 'núcleo':156A 'para':144A 'pela':35A,42A,55A 'pereira':167B,179A 'permanente':123A 'pesquisa':96A,153A,158A 'principalmente':73A 'processamento':52A 'produtividade':2A 'professor':60A,122A,132A 'profissional':92A,136A 'profnit':147A 'programa':125A 'projetos':85A,94A 'propriedade':138A 'pós':11A,108A 'robótica':81A 'rui':57A 'saba':166B,178A 'seguintes':75A 'senai/cimatec':173C 'sociais':80A 'tecnologia':105A,129A,143A 'tecnologias':79A 'tem':64A 'temas':76A 'titular':61A 'transferência':141A 'uefs':176C 'ufba':29A 'uneb':63A,175C 'universidade':25A 'visconde':44A 'área':67A 'âmbito':91A 'é':110A",0.06666667
f1a05ec3-4c2a-474d-8b1f-e0accfa3be63,Alfredo Eurico Rodrigues Matta,"Possui graduação em Processamento de Dados pela Universidade Salvador (1990), graduação em História pela Universidade Católica do Salvador (1988), mestrado em História pela Universidade Federal da Bahia (1996) e doutorado em Educação pela Universidade Federal da Bahia/ Université Laval (Canadá) (2001). Pós-Doutorado na Universidade do Porto em Educação a Distância e Comunidades de Aprendizagem Internacionais em Língua Portuguesa, apoiado pelo CNPQ (2006). Atualmente trabalha na Universidade do Estado da Bahia. É Professor do Doutorado Interinstitucional Multidisciplinar em Difusão do Conhecimento, Professor do Programa de Pós-Graduação em Educação e Contemporaneidades. Coordenador de Projetos de Pesquisa financiados pelo FNDE, MEC, MCT, CAPES, CNPQ, FAPESB e UNEB. Se dedica à pesquisar em modelagem computacional aplicada a EAD e a Tecnologia Educacional, e à educação em geral, principalmente no que se refere ao desenvolvimento de uma sociedade em rede, permeada de translocalidades pluriculturais, onde focaliza a variedade de plurilinguismo de expressão portuguesa. Tem experiência na área de Ciência da Computação, com ênfase em Sistemas de Informação, atuando principalmente nos seguintes temas: tecnologia educativa, educação à distância, informatica educacional, tecnologia da informação, pluriculturalidade, plurilinguismo de expressão portuguesa. Em História é pesquisador da História da Bahia e da História Medieval Ibérica. Orientador de Doutorado. Coordenador do Núcleo Bahia da Associação Brasileira de Educação a Distância. Membro da Academia Baiana de Educação, do Instituto Geográfico Histórico da Bahia e da Academia Portuguesa da História.",EDUCAÇÃO E CONTEMPORANEIDADE,"'1988':19A '1990':10A '1996':28A '2001':41A '2006':64A 'a':51A,117A,120A,146A,212A 'academia':216A,228A 'alfredo':232B,239A 'ao':133A 'aplicada':116A 'apoiado':61A 'aprendizagem':56A 'associação':208A 'atualmente':65A 'atuando':167A 'bahia':27A,37A,72A,194A,206A,225A 'baiana':217A 'brasileira':209A 'canadá':40A 'capes':104A 'católica':16A 'ciência':158A 'cnpq':63A,105A 'com':161A 'computacional':115A 'computação':160A 'comunidades':54A 'conhecimento':82A 'contemporaneidade':238C 'contemporaneidades':93A 'coordenador':94A,203A 'da':26A,36A,71A,159A,180A,191A,193A,196A,207A,215A,224A,227A,230A 'dados':6A 'de':5A,55A,86A,95A,97A,135A,141A,148A,150A,157A,165A,184A,201A,210A,218A 'dedica':110A 'desenvolvimento':134A 'difusão':80A 'distância':52A,176A,213A 'do':17A,47A,69A,75A,81A,84A,204A,220A 'doutorado':30A,44A,76A,202A 'e':29A,53A,92A,107A,119A,123A,195A,226A,237C 'ead':118A 'educacional':122A,178A 'educativa':173A 'educação':32A,50A,91A,125A,174A,211A,219A,236C 'em':3A,12A,21A,31A,49A,58A,79A,90A,113A,126A,138A,163A,187A 'estado':70A 'eurico':233B,240A 'experiência':154A 'expressão':151A,185A 'fapesb':106A 'federal':25A,35A 'financiados':99A 'fnde':101A 'focaliza':145A 'geográfico':222A 'geral':127A 'graduação':2A,11A,89A 'história':13A,22A,188A,192A,197A,231A 'histórico':223A 'ibérica':199A 'informatica':177A 'informação':166A,181A 'instituto':221A 'interinstitucional':77A 'internacionais':57A 'laval':39A 'língua':59A 'matta':235B,242A 'mct':103A 'mec':102A 'medieval':198A 'membro':214A 'mestrado':20A 'modelagem':114A 'multidisciplinar':78A 'na':45A,67A,155A 'no':129A 'nos':169A 'núcleo':205A 'onde':144A 'orientador':200A 'pela':7A,14A,23A,33A 'pelo':62A,100A 'permeada':140A 'pesquisa':98A 'pesquisador':190A 'pesquisar':112A 'pluriculturais':143A 'pluriculturalidade':182A 'plurilinguismo':149A,183A 'porto':48A 'portuguesa':60A,152A,186A,229A 'possui':1A 'principalmente':128A,168A 'processamento':4A 'professor':74A,83A 'programa':85A 'projetos':96A 'pós':43A,88A 'pós-doutorado':42A 'pós-graduação':87A 'que':130A 'rede':139A 'refere':132A 'rodrigues':234B,241A 'salvador':9A,18A 'se':109A,131A 'seguintes':170A 'sistemas':164A 'sociedade':137A 'tecnologia':121A,172A,179A 'tem':153A 'temas':171A 'trabalha':66A 'translocalidades':142A 'uma':136A 'uneb':108A 'universidade':8A,15A,24A,34A,46A,68A 'université':38A 'variedade':147A 'à':111A,124A,175A 'área':156A 'é':73A,189A 'ênfase':162A",0.0065789474
f1a05ec3-4c2a-474d-8b1f-e0accfa3be63,Alfredo Eurico Rodrigues Matta,"Possui graduação em Processamento de Dados pela Universidade Salvador (1990), graduação em História pela Universidade Católica do Salvador (1988), mestrado em História pela Universidade Federal da Bahia (1996) e doutorado em Educação pela Universidade Federal da Bahia/ Université Laval (Canadá) (2001). Pós-Doutorado na Universidade do Porto em Educação a Distância e Comunidades de Aprendizagem Internacionais em Língua Portuguesa, apoiado pelo CNPQ (2006). Atualmente trabalha na Universidade do Estado da Bahia. É Professor do Doutorado Interinstitucional Multidisciplinar em Difusão do Conhecimento, Professor do Programa de Pós-Graduação em Educação e Contemporaneidades. Coordenador de Projetos de Pesquisa financiados pelo FNDE, MEC, MCT, CAPES, CNPQ, FAPESB e UNEB. Se dedica à pesquisar em modelagem computacional aplicada a EAD e a Tecnologia Educacional, e à educação em geral, principalmente no que se refere ao desenvolvimento de uma sociedade em rede, permeada de translocalidades pluriculturais, onde focaliza a variedade de plurilinguismo de expressão portuguesa. Tem experiência na área de Ciência da Computação, com ênfase em Sistemas de Informação, atuando principalmente nos seguintes temas: tecnologia educativa, educação à distância, informatica educacional, tecnologia da informação, pluriculturalidade, plurilinguismo de expressão portuguesa. Em História é pesquisador da História da Bahia e da História Medieval Ibérica. Orientador de Doutorado. Coordenador do Núcleo Bahia da Associação Brasileira de Educação a Distância. Membro da Academia Baiana de Educação, do Instituto Geográfico Histórico da Bahia e da Academia Portuguesa da História.",DIFUSÃO DO CONHECIMENTO IFBA - SENAI/CIMATEC - LNCC - UNEB - UEFS,"'1988':19A '1990':10A '1996':28A '2001':41A '2006':64A 'a':51A,117A,120A,146A,212A 'academia':216A,228A 'alfredo':232B,244A 'ao':133A 'aplicada':116A 'apoiado':61A 'aprendizagem':56A 'associação':208A 'atualmente':65A 'atuando':167A 'bahia':27A,37A,72A,194A,206A,225A 'baiana':217A 'brasileira':209A 'canadá':40A 'capes':104A 'católica':16A 'ciência':158A 'cnpq':63A,105A 'com':161A 'computacional':115A 'computação':160A 'comunidades':54A 'conhecimento':82A,238C 'contemporaneidades':93A 'coordenador':94A,203A 'da':26A,36A,71A,159A,180A,191A,193A,196A,207A,215A,224A,227A,230A 'dados':6A 'de':5A,55A,86A,95A,97A,135A,141A,148A,150A,157A,165A,184A,201A,210A,218A 'dedica':110A 'desenvolvimento':134A 'difusão':80A,236C 'distância':52A,176A,213A 'do':17A,47A,69A,75A,81A,84A,204A,220A,237C 'doutorado':30A,44A,76A,202A 'e':29A,53A,92A,107A,119A,123A,195A,226A 'ead':118A 'educacional':122A,178A 'educativa':173A 'educação':32A,50A,91A,125A,174A,211A,219A 'em':3A,12A,21A,31A,49A,58A,79A,90A,113A,126A,138A,163A,187A 'estado':70A 'eurico':233B,245A 'experiência':154A 'expressão':151A,185A 'fapesb':106A 'federal':25A,35A 'financiados':99A 'fnde':101A 'focaliza':145A 'geográfico':222A 'geral':127A 'graduação':2A,11A,89A 'história':13A,22A,188A,192A,197A,231A 'histórico':223A 'ibérica':199A 'ifba':239C 'informatica':177A 'informação':166A,181A 'instituto':221A 'interinstitucional':77A 'internacionais':57A 'laval':39A 'lncc':241C 'língua':59A 'matta':235B,247A 'mct':103A 'mec':102A 'medieval':198A 'membro':214A 'mestrado':20A 'modelagem':114A 'multidisciplinar':78A 'na':45A,67A,155A 'no':129A 'nos':169A 'núcleo':205A 'onde':144A 'orientador':200A 'pela':7A,14A,23A,33A 'pelo':62A,100A 'permeada':140A 'pesquisa':98A 'pesquisador':190A 'pesquisar':112A 'pluriculturais':143A 'pluriculturalidade':182A 'plurilinguismo':149A,183A 'porto':48A 'portuguesa':60A,152A,186A,229A 'possui':1A 'principalmente':128A,168A 'processamento':4A 'professor':74A,83A 'programa':85A 'projetos':96A 'pós':43A,88A 'pós-doutorado':42A 'pós-graduação':87A 'que':130A 'rede':139A 'refere':132A 'rodrigues':234B,246A 'salvador':9A,18A 'se':109A,131A 'seguintes':170A 'senai/cimatec':240C 'sistemas':164A 'sociedade':137A 'tecnologia':121A,172A,179A 'tem':153A 'temas':171A 'trabalha':66A 'translocalidades':142A 'uefs':243C 'uma':136A 'uneb':108A,242C 'universidade':8A,15A,24A,34A,46A,68A 'université':38A 'variedade':147A 'à':111A,124A,175A 'área':156A 'é':73A,189A 'ênfase':162A",0.0065789474
f1a05ec3-4c2a-474d-8b1f-e0accfa3be63,Alfredo Eurico Rodrigues Matta,"Possui graduação em Processamento de Dados pela Universidade Salvador (1990), graduação em História pela Universidade Católica do Salvador (1988), mestrado em História pela Universidade Federal da Bahia (1996) e doutorado em Educação pela Universidade Federal da Bahia/ Université Laval (Canadá) (2001). Pós-Doutorado na Universidade do Porto em Educação a Distância e Comunidades de Aprendizagem Internacionais em Língua Portuguesa, apoiado pelo CNPQ (2006). Atualmente trabalha na Universidade do Estado da Bahia. É Professor do Doutorado Interinstitucional Multidisciplinar em Difusão do Conhecimento, Professor do Programa de Pós-Graduação em Educação e Contemporaneidades. Coordenador de Projetos de Pesquisa financiados pelo FNDE, MEC, MCT, CAPES, CNPQ, FAPESB e UNEB. Se dedica à pesquisar em modelagem computacional aplicada a EAD e a Tecnologia Educacional, e à educação em geral, principalmente no que se refere ao desenvolvimento de uma sociedade em rede, permeada de translocalidades pluriculturais, onde focaliza a variedade de plurilinguismo de expressão portuguesa. Tem experiência na área de Ciência da Computação, com ênfase em Sistemas de Informação, atuando principalmente nos seguintes temas: tecnologia educativa, educação à distância, informatica educacional, tecnologia da informação, pluriculturalidade, plurilinguismo de expressão portuguesa. Em História é pesquisador da História da Bahia e da História Medieval Ibérica. Orientador de Doutorado. Coordenador do Núcleo Bahia da Associação Brasileira de Educação a Distância. Membro da Academia Baiana de Educação, do Instituto Geográfico Histórico da Bahia e da Academia Portuguesa da História.",EDUCAÇÃO DE JOVENS E ADULTOS,"'1988':19A '1990':10A '1996':28A '2001':41A '2006':64A 'a':51A,117A,120A,146A,212A 'academia':216A,228A 'adultos':240C 'alfredo':232B,241A 'ao':133A 'aplicada':116A 'apoiado':61A 'aprendizagem':56A 'associação':208A 'atualmente':65A 'atuando':167A 'bahia':27A,37A,72A,194A,206A,225A 'baiana':217A 'brasileira':209A 'canadá':40A 'capes':104A 'católica':16A 'ciência':158A 'cnpq':63A,105A 'com':161A 'computacional':115A 'computação':160A 'comunidades':54A 'conhecimento':82A 'contemporaneidades':93A 'coordenador':94A,203A 'da':26A,36A,71A,159A,180A,191A,193A,196A,207A,215A,224A,227A,230A 'dados':6A 'de':5A,55A,86A,95A,97A,135A,141A,148A,150A,157A,165A,184A,201A,210A,218A,237C 'dedica':110A 'desenvolvimento':134A 'difusão':80A 'distância':52A,176A,213A 'do':17A,47A,69A,75A,81A,84A,204A,220A 'doutorado':30A,44A,76A,202A 'e':29A,53A,92A,107A,119A,123A,195A,226A,239C 'ead':118A 'educacional':122A,178A 'educativa':173A 'educação':32A,50A,91A,125A,174A,211A,219A,236C 'em':3A,12A,21A,31A,49A,58A,79A,90A,113A,126A,138A,163A,187A 'estado':70A 'eurico':233B,242A 'experiência':154A 'expressão':151A,185A 'fapesb':106A 'federal':25A,35A 'financiados':99A 'fnde':101A 'focaliza':145A 'geográfico':222A 'geral':127A 'graduação':2A,11A,89A 'história':13A,22A,188A,192A,197A,231A 'histórico':223A 'ibérica':199A 'informatica':177A 'informação':166A,181A 'instituto':221A 'interinstitucional':77A 'internacionais':57A 'jovens':238C 'laval':39A 'língua':59A 'matta':235B,244A 'mct':103A 'mec':102A 'medieval':198A 'membro':214A 'mestrado':20A 'modelagem':114A 'multidisciplinar':78A 'na':45A,67A,155A 'no':129A 'nos':169A 'núcleo':205A 'onde':144A 'orientador':200A 'pela':7A,14A,23A,33A 'pelo':62A,100A 'permeada':140A 'pesquisa':98A 'pesquisador':190A 'pesquisar':112A 'pluriculturais':143A 'pluriculturalidade':182A 'plurilinguismo':149A,183A 'porto':48A 'portuguesa':60A,152A,186A,229A 'possui':1A 'principalmente':128A,168A 'processamento':4A 'professor':74A,83A 'programa':85A 'projetos':96A 'pós':43A,88A 'pós-doutorado':42A 'pós-graduação':87A 'que':130A 'rede':139A 'refere':132A 'rodrigues':234B,243A 'salvador':9A,18A 'se':109A,131A 'seguintes':170A 'sistemas':164A 'sociedade':137A 'tecnologia':121A,172A,179A 'tem':153A 'temas':171A 'trabalha':66A 'translocalidades':142A 'uma':136A 'uneb':108A 'universidade':8A,15A,24A,34A,46A,68A 'université':38A 'variedade':147A 'à':111A,124A,175A 'área':156A 'é':73A,189A 'ênfase':162A",0.0065789474
